470276,https://www.airbnb.com/rooms/470276,20240622024403,2024-06-22,city scrape,orange room matrimonial navigli,"my house in in the meadle of park and private garden<br />duomo is 20 m from our house the room is big with marvellous light <br />I live with my son and a small kat<br />near by the house you coud find everything you need bar cafe restaurant,pizzerie drink place.","the area,is full of bar restaurant pizzeria,cafè,supermarket banks and place to have drink and relaxing",https://a0.muscache.com/pictures/12297193/59711213_original.jpg,748765,https://www.airbnb.com/users/show/748765,Bruna,2011-06-27,"Milan, Italy","ciao mi chiamo Bruna,mi piace condividere la mia casa,in questo modo conosco bellissime persone di ogni nazionalità
amo gli animali vivo con una micia e con un ragazzo di 17 anni
la mia casa è contornata di verde e nello stsso tempo è vicina alla metro perchè amo spostarmi facilmente
mi piace leggere e ascoltare buona musica
Hi ,my name is Bruna,
I live in our house with one catcher name is Saetta, and my son 17 years old,
I like green,my house is nearby private gardens. ",within a few hours,100%,88%,f,https://a0.muscache.com/im/users/748765/profile_pic/1342980347/original.jpg?aki_policy=profile_small,https://a0.muscache.com/im/users/748765/profile_pic/1342980347/original.jpg?aki_policy=profile_x_medium,Navigli,4,5,"['email', 'phone']",t,t,"Milan, Lombardy, Italy",NAVIGLI,,45.44513,9.16566,Private room in home,Private room,2,1.0,1 bath,1,1,"[""Washer"", ""Heating"", ""Dryer"", ""Wifi"", ""Air conditioning"", ""Essentials"", ""Shampoo"", ""Smoking allowed""]",$50.00,1,1125,1,1,1125,1125,1.0,1125.0,,t,0,0,0,52,2024-06-22,92,0,0,2012-06-11,2018-04-22,4.01,4.13,3.71,4.49,4.63,4.52,4.09,,f,4,0,4,0,0.63
470284,https://www.airbnb.com/rooms/470284,20240622024403,2024-06-22,city scrape,single room on navigli canals cente,,,https://a0.muscache.com/pictures/48279750/4c6a2b77_original.jpg,748765,https://www.airbnb.com/users/show/748765,Bruna,2011-06-27,"Milan, Italy","ciao mi chiamo Bruna,mi piace condividere la mia casa,in questo modo conosco bellissime persone di ogni nazionalità
amo gli animali vivo con una micia e con un ragazzo di 17 anni
la mia casa è contornata di verde e nello stsso tempo è vicina alla metro perchè amo spostarmi facilmente
mi piace leggere e ascoltare buona musica
Hi ,my name is Bruna,
I live in our house with one catcher name is Saetta, and my son 17 years old,
I like green,my house is nearby private gardens. ",within a few hours,100%,88%,f,https://a0.muscache.com/im/users/748765/profile_pic/1342980347/original.jpg?aki_policy=profile_small,https://a0.muscache.com/im/users/748765/profile_pic/1342980347/original.jpg?aki_policy=profile_x_medium,Navigli,4,5,"['email', 'phone']",t,t,,NAVIGLI,,45.44572,9.16718,Private room in home,Private room,1,1.0,1 bath,1,1,"[""Washer"", ""Heating"", ""Dryer"", ""Kitchen"", ""Hangers"", ""Wifi"", ""Extra pillows and blankets"", ""Hair dryer"", ""Essentials"", ""Bed linens"", ""Shampoo"", ""Hot water""]",$33.00,1,1125,1,1,1125,1125,1.0,1125.0,,t,0,0,0,265,2024-06-22,14,0,0,2012-06-27,2021-09-03,4.46,4.21,3.86,4.64,4.57,4.43,4.29,,f,4,0,4,0,0.10
470295,https://www.airbnb.com/rooms/470295,20240622024403,2024-06-22,city scrape,white doublebed on navigli center,,we are 5 minutes by waling from  via Tortona were  salone  del mobile <br />furniture expo is <br />this area is full of supermarket bar restaurant bakery and we are closer 1 minutes from Baden Pawell park were u could walk and breath,https://a0.muscache.com/pictures/84336601/244ebce7_original.jpg,748765,https://www.airbnb.com/users/show/748765,Bruna,2011-06-27,"Milan, Italy","ciao mi chiamo Bruna,mi piace condividere la mia casa,in questo modo conosco bellissime persone di ogni nazionalità
amo gli animali vivo con una micia e con un ragazzo di 17 anni
la mia casa è contornata di verde e nello stsso tempo è vicina alla metro perchè amo spostarmi facilmente
mi piace leggere e ascoltare buona musica
Hi ,my name is Bruna,
I live in our house with one catcher name is Saetta, and my son 17 years old,
I like green,my house is nearby private gardens. ",within a few hours,100%,88%,f,https://a0.muscache.com/im/users/748765/profile_pic/1342980347/original.jpg?aki_policy=profile_small,https://a0.muscache.com/im/users/748765/profile_pic/1342980347/original.jpg?aki_policy=profile_x_medium,Navigli,4,5,"['email', 'phone']",t,t,"Milan, Lombardy, Italy",NAVIGLI,,45.44528,9.16734,Private room in home,Private room,2,1.0,1 bath,1,2,"[""Kitchen"", ""Body soap"", ""Wifi"", ""Lock on bedroom door"", ""Long term stays allowed"", ""First aid kit"", ""Smoking allowed"", ""Mini fridge"", ""Cooking basics"", ""Coffee maker"", ""Ceiling fan"", ""Heating"", ""Dishes and silverware"", ""Hangers"", ""Cleaning available during stay"", ""Hair dryer"", ""Essentials"", ""Stove"", ""Laundromat nearby"", ""Paid parking on premises \u2013 1 space"", ""Microwave"", ""Extra pillows and blankets"", ""Washer \u2013\u00a0In unit"", ""Bed linens"", ""Hot water"", ""Oven"", ""Air conditioning"", ""Shampoo"", ""Smoke alarm""]",$42.00,1,1125,1,1,1125,1125,1.0,1125.0,,t,3,15,35,299,2024-06-22,275,32,1,2012-06-20,2024-06-06,4.34,4.44,4.21,4.63,4.63,4.51,4.27,,f,4,0,4,0,1.88
566637,https://www.airbnb.com/rooms/566637,20240622024403,2024-06-23,city scrape,Dream garden Mi city center on subway 10 p,"The apartment is located in the center of the city, in the most important street for shopping. It's exactly upstairs on Lima Station underground and 10 minutes walking from Central Station.<br />Free luggage storage in the building.<br />Garage available under the building (30€)<br />Possibility to organize private transport to and from the airport<br />Bright and quiet, it is perfect for families and groups of friends but we request you the silence in the house, in the terrace and on the stairs from 10pm to 8am.",,https://a0.muscache.com/pictures/35597316/a77e6810_original.jpg,2787018,https://www.airbnb.com/users/show/2787018,Giulia E Gianluca,2012-06-30,"Milan, Italy","Hello everyone! We are a family of musicians: Gianluca plays violin in the Teatro alla Scala orchestra, Giulia is a piano teacher. 
We are on your hand every time you need and we can advice you how to spend a lovely journey in such a pretty city as Milan, full of life, artistic and musical events.

Ciao a tutti! Siamo una famiglia di musicisti: Gianluca suona il violino nell'orchestra del Teatro alla Scala, Giulia è un'insegnante di pianoforte.
Siamo a vostra completa disposizione per ogni vostra necessità, e possiamo consigliarvi come trascorrere una piacevole permanenza in una così bella città come Milano, piena di vita, eventi artistici e culturali.",within an hour,100%,100%,t,https://a0.muscache.com/im/users/2787018/profile_pic/1343421060/original.jpg?aki_policy=profile_small,https://a0.muscache.com/im/users/2787018/profile_pic/1343421060/original.jpg?aki_policy=profile_x_medium,Zona 3,6,7,"['email', 'phone']",t,t,,BUENOS AIRES - VENEZIA,,45.48048,9.21135,Entire condo,Entire home/apt,10,2.0,2 baths,3,7,"[""Children\u2019s books and toys"", ""Kitchen"", ""Body soap"", ""Carbon monoxide alarm"", ""Private patio or balcony"", ""High chair"", ""Self check-in"", ""Long term stays allowed"", ""Pack \u2019n play/Travel crib"", ""Iron"", ""AC - split type ductless system"", ""Fire extinguisher"", ""Cooking basics"", ""Coffee maker"", ""Fast wifi \u2013 94 Mbps"", ""Refrigerator"", ""Room-darkening shades"", ""Hot water kettle"", ""Heating"", ""Baking sheet"", ""Dishes and silverware"", ""Hangers"", ""Clothing storage: closet"", ""Hair dryer"", ""Elevator"", ""Blender"", ""Essentials"", ""Crib"", ""Laundromat nearby"", ""Hammock"", ""Free washer \u2013 In unit"", ""Free dryer \u2013 In unit"", ""Dedicated workspace"", ""Wine glasses"", ""Paid parking garage on premises \u2013 2 spaces"", ""Freezer"", ""Keypad"", ""Drying rack for clothing"", ""Microwave"", ""Outdoor dining area"", ""Extra pillows and blankets"", ""Luggage dropoff allowed"", ""Dishwasher"", ""Bed linens"", ""Cleaning products"", ""Hot water"", ""HDTV with Netflix"", ""BBQ grill"", ""Oven"", ""Pets allowed"", ""Private backyard \u2013 Fully fenced"", ""Coffee"", ""Dining table"", ""Bidet"", ""Fire pit"", ""Outdoor furniture"", ""Single level home"", ""Shampoo"", ""Smoke alarm""]",$278.00,1,365,1,1,365,365,1.0,365.0,,t,1,1,1,1,2024-06-23,511,35,3,2012-07-19,2024-06-07,4.79,4.83,4.79,4.91,4.87,4.91,4.68,M08026,t,4,4,0,0,3.52
472998,https://www.airbnb.com/rooms/472998,20240622024403,2024-06-22,city scrape,il focolare domestico,"Room with a double bed, very quiet, with a terrace overlooking a garden. <br />The price is per person, for the second guest there is an additional price.<br />In the house there are cats.","there is a takeaway pizzeria nearby and a 24-hour Carrefour nearby, as well as other supermarkets",https://a0.muscache.com/pictures/0542cbb1-40da-4897-8ade-93acd75627ac.jpg,2345724,https://www.airbnb.com/users/show/2345724,Maria,2012-05-11,"Milan, Italy","",within a few hours,100%,49%,f,https://a0.muscache.com/im/pictures/user/00990889-3d8b-4135-bc18-19ccd7ad11d0.jpg?aki_policy=profile_small,https://a0.muscache.com/im/pictures/user/00990889-3d8b-4135-bc18-19ccd7ad11d0.jpg?aki_policy=profile_x_medium,,2,2,"['email', 'phone']",t,t,"Milano, Lombardia, Italy",BANDE NERE,,45.45712,9.14246,Private room in rental unit,Private room,1,1.0,1 shared bath,1,2,"[""Washer"", ""Kitchen"", ""Wifi"", ""Bread maker"", ""Iron"", ""Coffee maker"", ""Refrigerator"", ""Heating"", ""Dishes and silverware"", ""Hangers"", ""Hair dryer"", ""Elevator"", ""Essentials"", ""Central air conditioning"", ""Garden view"", ""Dedicated workspace"", ""Microwave"", ""Patio or balcony"", ""Dishwasher"", ""Bed linens"", ""Hot water"", ""Coffee"", ""TV"", ""EV charger"", ""Bidet"", ""Backyard"", ""Shampoo"", ""Breakfast""]",$50.00,1,31,1,1,31,31,1.0,31.0,,t,25,55,83,358,2024-06-22,34,14,0,2017-10-02,2024-04-18,4.79,4.82,4.85,4.76,4.74,4.5,4.65,T09845,f,2,1,1,0,0.42
473121,https://www.airbnb.com/rooms/473121,20240622024403,2024-06-22,city scrape,CHARMING APT CLOSE TO BOCCONI-IED-IEO-NABA DUOMO,"Luxury apartment near Duomo squeare- town center -equipped for breakfast till one week-<br />Very cozy,well furnished, equipped with every comfort for home. Quiet Building, well refined, elegant, in a really  nice a green area.",this neighborhood is very stately and quiet. there is a strong presence of greenery,https://a0.muscache.com/pictures/76579749/9dd64c9a_original.jpg,464145,https://www.airbnb.com/users/show/464145,Barbara,2011-03-26,"Milan, Italy","Hallo I ' m Barbara I live in Milano and I'm an architect.
I like travelling for work or holiday and learn about new places and people. 
I am very happy to accommodate and meet host. Give information about our country, Milan and most interesting places to visit.


",a few days or more,0%,0%,f,https://a0.muscache.com/im/users/464145/profile_pic/1425733221/original.jpg?aki_policy=profile_small,https://a0.muscache.com/im/users/464145/profile_pic/1425733221/original.jpg?aki_policy=profile_x_medium,Zona 5,5,5,"['email', 'phone']",t,t,"Milan, Lombardy, Italy",RIPAMONTI,,45.43463,9.20421,Private room in rental unit,Private room,2,1.0,1 shared bath,1,2,"[""Washer"", ""Heating"", ""Kitchen"", ""Wifi"", ""Elevator"", ""Essentials"", ""TV with standard cable"", ""Shampoo"", ""Breakfast""]",$103.00,2,1125,2,2,1125,1125,2.0,1125.0,,t,29,59,89,364,2024-06-22,0,0,0,,,,,,,,,,,f,5,3,2,0,
567935,https://www.airbnb.com/rooms/567935,20240622024403,2024-06-23,city scrape,Colourful cozy Apartment in the very City Centre!!,"This apartment is an architectural jewel with warm colors, overlooking one of the quietest streets in Milan, a stone's throw from the tourist area, near the university and the business district, and a few minutes walk from the best nightclubs. We promise your time in our apartment ""Stella Maris"" will be relaxing and fun, and very efficient if you come to work!<br /><br />We added a real kitchen (it's blue!)","The neighborhood is one of the most beautiful in Milan. You will be close to the Duomo, the Castle, the University and close to the most beautiful historical monuments eTeatro alla Scala.<br />Easy to reach Leonardo Da Vinci's Ultimate Dinner Dipinto,Enrique Cabrera Place-Santa Maria delle Grazie.<br /> Proximity to public transportation can take you anywhere in the city in a flash.<br />Served by Train or Bus from Malpensa Airport and Orio al Serio by Bus. Linate Airport - Metro 4 to San Babila M1 Station.",https://a0.muscache.com/pictures/7146377/c4af82ee_original.jpg,2794370,https://www.airbnb.com/users/show/2794370,Ben & Nora,2012-07-01,"Milan, Italy","Questa era la casa della mia mamma. Io e Nora la gestiamo cercando di onorare la sua memoria. Io vivo a Londra e faccio il professore universitario, e Nora fa duemila lavori, uno più interessante dell'altro.",within an hour,91%,100%,t,https://a0.muscache.com/im/pictures/user/ba52e2f9-a5c4-4862-b245-d6ed196ac67b.jpg?aki_policy=profile_small,https://a0.muscache.com/im/pictures/user/ba52e2f9-a5c4-4862-b245-d6ed196ac67b.jpg?aki_policy=profile_x_medium,Centro Storico,1,1,"['email', 'phone']",t,t,"Milan, Lombardy, Italy",TICINESE,,45.45599,9.18636,Entire rental unit,Entire home/apt,2,1.0,1 bath,1,1,"[""Conditioner"", ""Private entrance"", ""Kitchen"", ""Carbon monoxide alarm"", ""Wifi"", ""Self check-in"", ""Induction stove"", ""First aid kit"", ""Iron"", ""Cooking basics"", ""Free dryer"", ""Mini fridge"", ""Lockbox"", ""Room-darkening shades"", ""Hot water kettle"", ""Heating"", ""Baking sheet"", ""Dishes and silverware"", ""Hangers"", ""City skyline view"", ""Hair dryer"", ""Ethernet connection"", ""Elevator"", ""Essentials"", ""Paid parking on premises"", ""Normale shampoo"", ""Paid street parking off premises"", ""Sapone liquido body soap"", ""Dedicated workspace"", ""Wine glasses"", ""Drying rack for clothing"", ""Shower gel"", ""Extra pillows and blankets"", ""Luggage dropoff allowed"", ""Bed linens"", ""Cleaning products"", ""Hot water"", ""Pets allowed"", ""Rice maker"", ""Books and reading material"", ""Clothing storage"", ""Coffee"", ""TV"", ""Ari single oven"", ""Air conditioning"", ""Dining table"", ""Bidet"", ""Coffee maker: pour-over coffee"", ""Shared patio or balcony"", ""Piccolo frigo senza freezer refrigerator"", ""Backyard"", ""Smoke alarm"", ""Toaster""]",$75.00,2,7,2,2,1125,1125,2.0,1125.0,,t,6,14,18,261,2024-06-23,435,43,1,2012-09-08,2024-06-04,4.86,4.88,4.91,4.9,4.91,4.9,4.77,,t,1,1,0,0,3.03
496612,https://www.airbnb.com/rooms/496612,20240622024403,2024-06-23,city scrape,GORGEOUS 6PEOPLE 10 mins Duomo wif,,"the neighborhood is very lively, fashionable , in the evening you can not get bored by the presence of numerous restaurants , clubs and bars. A 5 (email hidden) are also the spas of Milan, 10 minutes the Navigli and if you want to go to the Duomo with the metro you just need 3 Metro stops.",https://a0.muscache.com/pictures/f025256f-3418-4383-a1c2-e0475b1ca3b1.jpg,2452841,https://www.airbnb.com/users/show/2452841,Paolo & Yuki,2012-05-24,"Milan, Italy","Hello Yuki  Is Italian and Japanese origins, Paolo is italian Sicily   and Istria origins. We love culture and food of the world...  children, animals, music ,flowers and we are glad  to  receive guests from everywhere... and we love travel by car with the family as well our cute dog Otto , breed Lagotto Romagnolo , anallergic dog he doesn’t loose hair is our little last son Thank you",within an hour,100%,95%,f,https://a0.muscache.com/im/users/2452841/profile_pic/1352111149/original.jpg?aki_policy=profile_small,https://a0.muscache.com/im/users/2452841/profile_pic/1352111149/original.jpg?aki_policy=profile_x_medium,Porta Romana,9,15,"['email', 'phone']",t,t,"Milan, Lombardy, Italy",PORTA ROMANA,,45.44961657407504,9.199477436231222,Entire condo,Entire home/apt,4,1.0,1 bath,1,2,"[""Smart lock"", ""22 inch TV with Netflix"", ""Children\u2019s books and toys"", ""Kitchen"", ""Body soap"", ""Wifi"", ""Paid parking off premises"", ""Self check-in"", ""Long term stays allowed"", ""First aid kit"", ""Iron"", ""Cooking basics"", ""Indoor fireplace"", ""Refrigerator"", ""Room-darkening shades"", ""Hot water kettle"", ""Heating"", ""Free street parking"", ""Dishes and silverware"", ""Hangers"", ""Coffee maker: Nespresso"", ""City skyline view"", ""Cleaning available during stay"", ""Hair dryer"", ""Elevator"", ""Gas stove"", ""Essentials"", ""Crib"", ""Free washer \u2013 In unit"", ""Dedicated workspace"", ""Freezer"", ""Drying rack for clothing"", ""Shower gel"", ""Microwave"", ""Bed linens"", ""Cleaning products"", ""Hot water"", ""Oven"", ""Clothing storage"", ""Coffee"", ""Air conditioning"", ""Shampoo""]",$83.00,2,365,2,2,1125,1125,2.0,1125.0,,t,1,31,55,227,2024-06-23,181,32,3,2012-09-14,2024-06-16,4.51,4.58,4.49,4.61,4.63,4.64,4.47,,t,9,9,0,0,1.26
579191,https://www.airbnb.com/rooms/579191,20240622024403,2024-06-22,city scrape,Elegant Loft Conversion Ex Marble Workshop,"A wrought-iron spiral staircase leads down to the romantic, light-filled space of this welcoming split-level loft with private garden. The original loft interior in industrial style was designed by renowned Milanese architects. Available only for medium long contract.<br /><br />Huge, well restored, former marble workshop open space of 110 mq + 30 mq garden, <br />A lot of light.  Fully carrefully equipped, industrial atmosphere with raw loft details. <br />The loft, designed and decorated by Mariaplatz, a group of well-known young Milanese architects, is an open space flat on two floors, quiet and charming.<br />On the ground floor there is a living room with flat screen TV, a big sofa wich can became two single beds if requiered, kitchen and a bathroom with shower. The open space bedroom on the mezanine overlooks the living room. <br />Fresh sheets and towels will be provided at your arrival. <br /><br />SERVICES<br />- double bed<br />- big sofa <br />- vacuum cleaner<br />- hairdry","The neighbourhood is cool and full of artist studios, fashion offices: old factories now converted into different kinds of business ranging from photography and fashion firms, to music labels and private flats.<br />Along the Navigli side you can either walk, run or have fun time among nice shops and cool bars of the area (Navigli-Tortona). <br />10 mins walking distance from the design area <br />Perfect Location during the Salone del Mobile and fashion week.<br /><br />The neighborhood is quiet and very well connected to the center and zona Tortona although Expo 2015 works are blocking part of the town. Navigli, Università Bocconi, Porta Ticinese and Colonne di San Lorenzo are 10-20 minutes walking distance with a large selection of restaurants, bars, historical areas and parcs to enjoy Milan.<br /><br />-  A supermarket, shops, pizzeria, sushi or vegetarian restaurants (good or cheap) along the street. <br />- Milano's best ice cream only few steps from home",https://a0.muscache.com/pictures/airflow/Hosting-579191/original/20ebe65e-d00f-4086-9f46-cca852b9b96f.jpg,2848811,https://www.airbnb.com/users/show/2848811,Rita,2012-07-06,"Milan, Italy","I'm young  professional, responsible host who loves travelling and enjoying life! 
Rita",within a few hours,100%,73%,t,https://a0.muscache.com/im/pictures/user/9c4a43fe-5b5b-45f8-b240-b17b0a9cc2b3.jpg?aki_policy=profile_small,https://a0.muscache.com/im/pictures/user/9c4a43fe-5b5b-45f8-b240-b17b0a9cc2b3.jpg?aki_policy=profile_x_medium,Barona,14,115,"['email', 'phone', 'work_email']",t,t,"Milan, MI, Italy",S. CRISTOFORO,,45.44702,9.15458,Entire loft,Entire home/apt,4,1.0,1 bath,1,2,"[""Fast wifi \u2013 82 Mbps"", ""Private entrance"", ""Kitchen"", ""Body soap"", ""Carbon monoxide alarm"", ""Long term stays allowed"", ""Stainless steel gas stove"", ""Fire extinguisher"", ""AC - split type ductless system"", ""Iron"", ""Cooking basics"", ""Coffee maker"", ""Ceiling fan"", ""Exterior security cameras on property"", ""Refrigerator"", ""Hot water kettle"", ""Free street parking"", ""Baking sheet"", ""Dishes and silverware"", ""Hangers"", ""Hair dryer"", ""Essentials"", ""Free washer \u2013 In unit"", ""Garden view"", ""Dedicated workspace"", ""Freezer"", ""Shower gel"", ""Microwave"", ""Extra pillows and blankets"", ""Patio or balcony"", ""Dishwasher"", ""TV with standard cable"", ""Bed linens"", ""Exercise equipment: yoga mat"", ""Oven"", ""Private backyard \u2013 Fully fenced"", ""Central heating"", ""Dining table"", ""Bidet"", ""Outdoor furniture"", ""Shampoo"", ""Smoke alarm"", ""Toaster""]",$180.00,3,360,3,3,360,360,3.0,360.0,,t,29,59,89,364,2024-06-22,73,2,0,2013-04-15,2023-10-19,4.84,4.94,4.78,4.8,4.94,4.59,4.67,,f,9,9,0,0,0.54
504777,https://www.airbnb.com/rooms/504777,20240622024403,2024-06-22,city scrape,Nice flat Fiera/Tortona District!,"50 square metres cosy apartment in one of the most interesting and safe areas of Milan (Fiera MilanoCity, Piazza Piemonte, via Washington, via Savona, via Tortona), very calm and quiet.",,https://a0.muscache.com/pictures/6415676/d004aa3d_original.jpg,2482725,https://www.airbnb.com/users/show/2482725,Costanza,2012-05-28,"Milan, Italy","Ciao, benvenuto sul mio profilo!
Sono un'amante dei posti tranquilli e un pò retrò, mi piace condividere del buon cibo e un bicchiere di vino (bianco!) con gli amici.
Ho avuto la fortuna di viaggiare parecchio nella mia vita e di vivere momenti indimenticabili nella campagna toscana come davanti al ghiacciaio Perito Moreno in Argentina! 
Ti aspetto nella mia casa milanese, senza pretese ma aperta con il cuore a chi vuole viaggiare in maniera semplice e confortevole e a chi condivide con me la passione della scoperta.

a presto
Costanza",N/A,N/A,0%,f,https://a0.muscache.com/im/users/2482725/profile_pic/1338370707/original.jpg?aki_policy=profile_small,https://a0.muscache.com/im/users/2482725/profile_pic/1338370707/original.jpg?aki_policy=profile_x_medium,Zona 6,2,2,"['email', 'phone']",t,t,,WASHINGTON,,45.45845,9.15358,Entire rental unit,Entire home/apt,3,1.0,1 bath,1,3,"[""Washer"", ""Kitchen"", ""Body soap"", ""Long term stays allowed"", ""Paid parking garage off premises"", ""Cooking basics"", ""Ceiling fan"", ""Refrigerator"", ""Heating"", ""Dishes and silverware"", ""Hangers"", ""Clothing storage: closet and dresser"", ""Hair dryer"", ""Elevator"", ""Gas stove"", ""Essentials"", ""Paid parking on premises"", ""Wine glasses"", ""Freezer"", ""Drying rack for clothing"", ""Microwave"", ""Dishwasher"", ""Bed linens"", ""Hot water"", ""Mosquito net"", ""Air conditioning"", ""Dining table"", ""Bidet"", ""Single level home""]",$90.00,7,365,7,7,365,365,7.0,365.0,,t,0,0,0,21,2024-06-22,4,0,0,2012-09-14,2013-08-29,5.0,4.75,5.0,5.0,5.0,4.5,4.5,,f,2,2,0,0,0.03
582623,https://www.airbnb.com/rooms/582623,20240622024403,2024-06-23,city scrape,Bright Apartment in Area Isola,"The flat  consists of four rooms on two stories: living room, kitchen, bathroom with shower and a nice terrace downstair, and two bedrooms, one with bathroom ( and a great jacuzzi in it!) upstair.<br />It has several facilities: washing machine, dishwasher, microwave, Nespresso machine, internet wifi, A/C in every room.<br />The apartment is 2nd floor in a traditional Milanese 19th century apartment building. The surrounding area (called 'isola') offers everything you need for a stay in Milan.","Isola is a trendy neighborhood characterized by graffiti and narrow streets full of trendy boutiques, organic groceries and second-hand shops. Alongside the cozy family-run trattorias are hip cafes set in leafy courtyards, while the casual bars in the area's former warehouses are popular with bikers, punks and students. At the weekend, flea markets are held around the Renaissance church of Santa Maria alla Fontana, known for its frescoed arcades.",https://a0.muscache.com/pictures/hosting/Hosting-582623/original/3df88d3a-fe03-4593-9a76-e99d52c277e9.jpeg,2869541,https://www.airbnb.com/users/show/2869541,Giovanna,2012-07-08,"Milan, Italy","I'm an acrobatic dancer but sometime I work in advertaising too in production.
I'm really happy that someone occupies my apt when I out!
I travel a lot for a job, and I love trabìvelling for pleasure too!
I like also cinema, books and get enjoy with friends!",within a few hours,83%,13%,f,https://a0.muscache.com/im/users/2869541/profile_pic/1341795917/original.jpg?aki_policy=profile_small,https://a0.muscache.com/im/users/2869541/profile_pic/1341795917/original.jpg?aki_policy=profile_x_medium,Centro Direzionale,2,2,"['email', 'phone']",t,t,"Milan, Lombardy, Italy",ISOLA,,45.48627,9.19064,Entire rental unit,Entire home/apt,4,2.0,2 baths,2,2,"[""Washer"", ""Kitchen"", ""Wifi"", ""Paid parking off premises"", ""Iron"", ""Cooking basics"", ""Fire extinguisher"", ""Smoking allowed"", ""Bathtub"", ""Coffee maker"", ""Refrigerator"", ""Room-darkening shades"", ""Heating"", ""Free street parking"", ""Dishes and silverware"", ""Hangers"", ""Hot tub"", ""Hair dryer"", ""Gas stove"", ""Essentials"", ""Wine glasses"", ""Freezer"", ""Drying rack for clothing"", ""Microwave"", ""Extra pillows and blankets"", ""Patio or balcony"", ""Dishwasher"", ""Bed linens"", ""Hot water"", ""Oven"", ""Pets allowed"", ""Air conditioning"", ""Bidet"", ""Host greets you"", ""Toaster""]",$180.00,2,30,2,2,30,30,2.0,30.0,,t,25,55,81,356,2024-06-23,47,2,0,2012-10-08,2024-04-18,4.13,4.24,3.7,4.6,4.38,4.61,4.06,,f,2,1,1,0,0.33
