974116,https://www.airbnb.com/rooms/974116,20240622024403,2024-06-22,city scrape,la mansarda dell'artista Chisesi,,,https://a0.muscache.com/pictures/15197231/c71bcc06_original.jpg,5327727,https://www.airbnb.com/users/show/5327727,Andrea,2013-03-05,"Milan, Italy","ciao mi chiamo Andrea Chisesi, sono un pittore, la mia casa rispecchia le mie passioni",within a day,50%,0%,f,https://a0.muscache.com/im/users/5327727/profile_pic/1377602338/original.jpg?aki_policy=profile_small,https://a0.muscache.com/im/users/5327727/profile_pic/1377602338/original.jpg?aki_policy=profile_x_medium,Zona 2,5,11,"['email', 'phone', 'work_email']",t,t,,LORETO,,45.49173,9.21648,Entire loft,Entire home/apt,3,1.0,1 bath,1,2,"[""Dedicated workspace"", ""Washer"", ""Refrigerator"", ""Heating"", ""Free street parking"", ""Dishes and silverware"", ""TV"", ""Hangers"", ""Wifi"", ""Kitchen"", ""Self check-in"", ""Smoking allowed"", ""Elevator"", ""Luggage dropoff allowed"", ""Essentials"", ""Long term stays allowed"", ""Building staff"", ""Iron"", ""Hot water"", ""Pets allowed""]",$100.00,7,365,7,7,365,365,7.0,365.0,,t,28,58,88,363,2024-06-22,3,0,0,2018-11-30,2020-01-29,4.33,5.0,5.0,4.0,5.0,4.33,4.33,,f,1,1,0,0,0.04
709463,https://www.airbnb.com/rooms/709463,20240622024403,2024-06-22,city scrape,Cosy Place Tortona- Mudec Museum- Darsena,,"Wondreful neibarhood where there was a factry  of iron and now all is changes with fashon companies ( Zegna , Armani Silos) and Mudec MUseum. There is also a litte cinema that make the story of indipendent distibution films in Milano , as it' was also the first Roky Horror House straming the oroginal Musical . You can meet models and dancers as ther is the Teatro alla Scala choir room. With parco solary this area it is full of nature colse to navigli and full of culture and artits ! ;)",https://a0.muscache.com/pictures/26063301/d170d4fa_original.jpg,3008902,https://www.airbnb.com/users/show/3008902,Jvonne Simona,2012-07-21,,"Ciao sono Italiana, ho vissuto in Francia , parlo inglese, francese e spagnolo.
;) !",a few days or more,31%,36%,f,https://a0.muscache.com/im/users/3008902/profile_pic/1342886582/original.jpg?aki_policy=profile_small,https://a0.muscache.com/im/users/3008902/profile_pic/1342886582/original.jpg?aki_policy=profile_x_medium,Navigli,3,6,"['email', 'phone']",t,t,"Milan, Lombardy, Italy",TORTONA,,45.45347,9.15904,Entire rental unit,Entire home/apt,4,1.0,1 bath,1,2,"[""Washer"", ""Children\u2019s books and toys"", ""Kitchen"", ""Carbon monoxide alarm"", ""Wifi"", ""Iron"", ""Fire extinguisher"", ""Indoor fireplace"", ""Cooking basics"", ""Coffee maker"", ""Smoking allowed"", ""Refrigerator"", ""Heating"", ""Free street parking"", ""Dishes and silverware"", ""Hangers"", ""Hair dryer"", ""Elevator"", ""Paid parking on premises"", ""Essentials"", ""Pocket wifi"", ""Stove"", ""Dedicated workspace"", ""Extra pillows and blankets"", ""Luggage dropoff allowed"", ""Dishwasher"", ""Bed linens"", ""Cleaning products"", ""Hot water"", ""Oven"", ""Portable fans"", ""12 inch HDTV"", ""Shampoo""]",$77.00,4,95,3,4,95,95,4.0,95.0,,t,6,36,45,103,2024-06-22,127,4,0,2013-01-20,2023-10-16,4.36,4.62,4.42,4.44,4.4,4.75,4.4,,f,2,1,1,0,0.91
975346,https://www.airbnb.com/rooms/975346,20240622024403,2024-06-23,city scrape,Super apartment navigli!,,,https://a0.muscache.com/pictures/29464742/e12a4a11_original.jpg,1296653,https://www.airbnb.com/users/show/1296653,Costanza,2011-10-16,"Milan, Italy","We are Italian, we work both in marketing & communication and in catering. We have twins and a small dog named Mitsu. We love traveling and being in company!",within an hour,100%,54%,t,https://a0.muscache.com/im/users/1296653/profile_pic/1318763768/original.jpg?aki_policy=profile_small,https://a0.muscache.com/im/users/1296653/profile_pic/1318763768/original.jpg?aki_policy=profile_x_medium,Navigli,2,3,"['email', 'phone']",t,t,,NAVIGLI,,45.45062,9.17698,Entire rental unit,Entire home/apt,4,2.0,2 baths,1,2,"[""Washer"", ""Other gas stove"", ""Kitchen"", ""Wifi"", ""Long term stays allowed"", ""Shared backyard \u2013 Fully fenced"", ""Iron"", ""Cooking basics"", ""Refrigerator"", ""Room-darkening shades"", ""Heating"", ""Dishes and silverware"", ""Paid parking lot on premises"", ""Hangers"", ""Clothing storage: closet and dresser"", ""Elevator"", ""Dedicated workspace"", ""Wine glasses"", ""Freezer"", ""Outdoor dining area"", ""Extra pillows and blankets"", ""Luggage dropoff allowed"", ""Dishwasher"", ""Bed linens"", ""Cleaning products"", ""Hot water"", ""Mosquito net"", ""Pets allowed"", ""TV"", ""Air conditioning"", ""Dining table"", ""Bidet"", ""Single level home""]",$150.00,1,1125,1,1,1125,1125,1.0,1125.0,,t,7,26,56,331,2024-06-23,8,1,0,2013-04-12,2024-05-19,4.57,5.0,5.0,4.86,4.63,4.63,4.38,,f,2,2,0,0,0.06
709966,https://www.airbnb.com/rooms/709966,20240622024403,2024-06-23,city scrape,Town centre - metrò Porta Romana,"Small apartment, comfortable and quiet, in a strategic position in the heart of Milan, in a green and lively district but slightly away from the chaotic and touristic center of the city.","Very green and cool neighborhood, with many shops, bars, restaurants and a lively nightlife, but not in the mainstream touristic area: mainly frequented by locals.",https://a0.muscache.com/pictures/86993275/211a4e59_original.jpg,3653422,https://www.airbnb.com/users/show/3653422,Anna,2012-09-23,"Milan, Italy","I've been living in Milano since birth and I know almost every corner and secret of it, thus I can give lot of information and advice, both practical and cultural/recreational, about how to organize a best stay in this town. 
I am an architect and I'm particularly interested in my town art and architecture. 

Vivo a Milano dalla nascita e ne conosco quasi ogni angolo e segreto, posso dunque fornire parecchie informazioni e consigli su come organizzare al meglio la permanenza in questa città, sia dal punto di vista pratico che da quello culturale e ricreativo. 
Sono un architetto e mi interessano molto l'arte e l'architettura della mia città.",N/A,N/A,N/A,f,https://a0.muscache.com/im/pictures/user/93b8e643-1017-41a3-806b-6712bb099717.jpg?aki_policy=profile_small,https://a0.muscache.com/im/pictures/user/93b8e643-1017-41a3-806b-6712bb099717.jpg?aki_policy=profile_x_medium,Centro Storico,1,1,"['email', 'phone']",t,t,"Milan, Lombardy, Italy",GUASTALLA,,45.45626,9.20364,Entire rental unit,Entire home/apt,2,1.0,1 bath,1,2,"[""Conditioner"", ""Private entrance"", ""Kitchen"", ""Body soap"", ""Carbon monoxide alarm"", ""Long term stays allowed"", ""First aid kit"", ""Stainless steel gas stove"", ""Iron"", ""Wifi \u2013 48 Mbps"", ""Cooking basics"", ""Bathtub"", ""Room-darkening shades"", ""Hot water kettle"", ""Dishes and silverware"", ""Hangers"", ""Clothing storage: closet"", ""Hair dryer"", ""Elevator"", ""Essentials"", ""Central air conditioning"", ""Laundromat nearby"", ""Free washer \u2013 In unit"", ""Dedicated workspace"", ""Board games"", ""Freezer"", ""Drying rack for clothing"", ""Microwave"", ""Extra pillows and blankets"", ""Luggage dropoff allowed"", ""Dishwasher"", ""Bed linens"", ""Cleaning products"", ""Hot water"", ""Toaster"", ""Portable fans"", ""Books and reading material"", ""Coffee"", ""TV"", ""Central heating"", ""Dining table"", ""Coffee maker: espresso machine"", ""Shampoo"", ""Smoke alarm"", ""Host greets you"", ""IGNIS refrigerator""]",$48.00,31,125,31,31,125,125,31.0,125.0,,t,0,0,0,114,2024-06-23,34,0,0,2012-11-02,2022-06-25,4.63,4.56,4.76,4.94,5.0,4.68,4.56,,f,1,1,0,0,0.24
976417,https://www.airbnb.com/rooms/976417,20240622024403,2024-06-23,city scrape,Charming apartment in a vibrant neighborhood,"In occasion of the Design Week in April, I am making available the bright and welcoming apartment where I normally live with my family. We are located in Porta Venezia, just outside the inner city walls to the east, one of the liveliest neighborhoods in the city. We are on the third floor, with a beautiful view of a spacious square. Unfortunately, as there is no elevator, the apartment is not accessible to individuals with mobility disabilities.","Porta Venezia epitomizes the multifaceted nature of the city, embracing its cosmopolitan ambiance through a myriad of international cuisines. Celebrating diversity and inclusion, the district hosts LGBTQ+ clubs and is the proud venue for Italy's largest Pride event. It is also a hub for shopping and fashion, boasting stylish boutiques on Corso Venezia that showcase both renowned brands and emerging designer ateliers. The renowned Corso Buenos Aires adds to the allure with its array of window displays. Porta Venezia further reveals its artistic side through the captivating floral architecture of early 19th-century Art Nouveau. Lastly, its natural side unfolds in the English-style gardens, groves, and streams of the Giardini Montanelli.",https://a0.muscache.com/pictures/miso/Hosting-976417/original/bc98ff90-bcc8-402e-9b36-74f41ec135fa.jpeg,5380779,https://www.airbnb.com/users/show/5380779,Rossana,2013-03-08,"Milan, Italy","I'm an architect, live in Milan with my son, who is 16 years old. I love to travel, play music and sing :-)
",N/A,N/A,100%,f,https://a0.muscache.com/im/users/5380779/profile_pic/1362863776/original.jpg?aki_policy=profile_small,https://a0.muscache.com/im/users/5380779/profile_pic/1362863776/original.jpg?aki_policy=profile_x_medium,Zona 3,1,1,"['email', 'phone']",t,f,"Milano, Lombardia, Italy",BUENOS AIRES - VENEZIA,,45.47387,9.20708,Entire home,Entire home/apt,3,2.5,2.5 baths,2,3,"[""Washer"", ""Kitchen"", ""Wifi"", ""Private patio or balcony"", ""Paid parking off premises"", ""Courtyard view"", ""Iron"", ""Cooking basics"", ""Refrigerator"", ""Heating"", ""Dishes and silverware"", ""Hangers"", ""City skyline view"", ""Hair dryer"", ""Essentials"", ""Stove"", ""Dishwasher"", ""Hot water"", ""Oven"", ""TV"", ""Shampoo""]",$400.00,6,10,6,6,10,10,6.0,10.0,,t,8,38,68,158,2024-06-23,5,1,0,2013-04-15,2024-04-21,4.8,5.0,5.0,5.0,5.0,5.0,5.0,,f,1,1,0,0,0.04
710637,https://www.airbnb.com/rooms/710637,20240622024403,2024-06-22,city scrape,"STUDIO CLOSE TO BOCCONI University, NABA, IULM","Very quite and lovely studio.Kitchenette with mini terrace.Equipped with every comfort, near the subway which leads directly to the center (10'). Walking distance to all trendy locations and to the University IULM (5 minutes walking) , NABA, BOcconi and the Tortona area.<br />The cost includes all expenses except electricity and Wi-Fi",,https://a0.muscache.com/pictures/9576252/25ad88fc_original.jpg,2158679,https://www.airbnb.com/users/show/2158679,Annabella,2012-04-17,"Milan, Italy",Tratta gli altri come vuoi essere trattatə :-),within a day,63%,3%,f,https://a0.muscache.com/im/users/2158679/profile_pic/1334662190/original.jpg?aki_policy=profile_small,https://a0.muscache.com/im/users/2158679/profile_pic/1334662190/original.jpg?aki_policy=profile_x_medium,Centro Storico,5,5,"['email', 'phone']",t,t,,NAVIGLI,,45.44588,9.16243,Entire rental unit,Entire home/apt,2,1.0,1 bath,1,2,"[""Washer"", ""Private entrance"", ""Kitchen"", ""Wifi"", ""Long term stays allowed"", ""First aid kit"", ""Iron"", ""Cooking basics"", ""Smoking allowed"", ""Refrigerator"", ""Electric stove"", ""Room-darkening shades"", ""Heating"", ""Free street parking"", ""Dishes and silverware"", ""Hangers"", ""City skyline view"", ""Clothing storage: closet and dresser"", ""Elevator"", ""Dedicated workspace"", ""Freezer"", ""Drying rack for clothing"", ""Microwave"", ""Extra pillows and blankets"", ""Cleaning products"", ""Hot water"", ""Mosquito net"", ""TV"", ""Air conditioning"", ""Dining table"", ""Bidet""]",$52.00,260,500,24,260,500,500,241.3,500.0,,t,0,24,28,298,2024-06-22,4,0,0,2013-06-07,2022-09-05,5.0,5.0,5.0,5.0,5.0,4.75,5.0,,f,5,5,0,0,0.03
976705,https://www.airbnb.com/rooms/976705,20240622024403,2024-06-22,city scrape,central chic design apartment,"Chic sunny flat. <br />Next to Malpensa express, Cadorna metro station with red and green line connection. Walking distance to Duomo, Leonardo's Last supper, Triennale, Sempione Park and Castle. Restaurants, pizzerias and supermarket next door.",,https://a0.muscache.com/pictures/54dc0ae6-a7f8-4c8e-9e6f-47dc6a449495.jpg,5344212,https://www.airbnb.com/users/show/5344212,Daniela Chiara,2013-03-06,"Milan, Italy","I'm an artist, I like to travel and know people",within a few hours,100%,89%,t,https://a0.muscache.com/im/users/5344212/profile_pic/1362587556/original.jpg?aki_policy=profile_small,https://a0.muscache.com/im/users/5344212/profile_pic/1362587556/original.jpg?aki_policy=profile_x_medium,Centro Storico,2,3,"['email', 'phone']",t,t,,MAGENTA - S. VITTORE,,45.46859,9.17286,Entire rental unit,Entire home/apt,5,2.0,2 baths,3,7,"[""Washer"", ""Kitchen"", ""Body soap"", ""Wifi"", ""Iron"", ""Indoor fireplace"", ""Bathtub"", ""Refrigerator"", ""Heating"", ""Dishes and silverware"", ""Hair dryer"", ""Elevator"", ""Essentials"", ""Free residential garage on premises"", ""Drying rack for clothing"", ""Piano"", ""Bed linens"", ""Hot water"", ""Children\u2019s books and toys for ages 0-2 years old, 2-5 years old, 5-10 years old, and 10+ years old"", ""Books and reading material"", ""Portable fans"", ""TV"", ""Dining table"", ""Bidet""]",$329.00,3,20,3,3,20,20,3.0,20.0,,t,24,54,67,244,2024-06-22,22,6,0,2016-04-18,2024-04-20,4.82,4.86,4.77,4.91,4.95,4.95,4.77,,f,2,2,0,0,0.22
711493,https://www.airbnb.com/rooms/711493,20240622024403,2024-06-22,city scrape,Appartamento zona  Naviglio con Garden privato,"A nice 50-meter apartment<br /> in a characteristic and charming neighborhood called Navigli, they are water channels such as in Amsterdam or Canal Saint Martin in Paris, with many bars and restaurants, mainly evenings and reachable on foot... There is also nearby the Bocconi University and the Napa Institute... Taking tram no. 3 in Corso San Gottardo in very few stops you are in Piazza Duomo",The Navigli district is very nice especially for young people who love Milan by night... It is very convenient for those who have to do master's degrees at Bocconi University or Napa and can also be reached on foot....and with tram no. 3 that you take in (Corso  San Gottardo) in a few stops you reach the center ( cathedral and shopping streets),https://a0.muscache.com/pictures/df7cb624-c3aa-48e8-a83b-0cac17916644.jpg,3661755,https://www.airbnb.com/users/show/3661755,Sabrina,2012-09-24,"Milan, Italy","Sono di Milano ho un negozio d'abbigliamento da donna , mi piace molto viaggiare ",within an hour,100%,98%,t,https://a0.muscache.com/im/pictures/user/4df83acf-b0e7-4e84-803c-95cdb8a9086b.jpg?aki_policy=profile_small,https://a0.muscache.com/im/pictures/user/4df83acf-b0e7-4e84-803c-95cdb8a9086b.jpg?aki_policy=profile_x_medium,Navigli,2,2,"['email', 'phone']",t,t,"Milan, Lombardy, Italy",NAVIGLI,,45.44852,9.17662,Entire condo,Entire home/apt,2,1.0,1 bath,1,2,"[""Conditioner"", ""Private entrance"", ""Kitchen"", ""Body soap"", ""Wifi"", ""Bosch induction stove"", ""First aid kit"", ""Pack \u2019n play/Travel crib"", ""Iron"", ""Cooking basics"", ""Mini fridge"", ""Refrigerator"", ""Hot water kettle"", ""Heating"", ""Free street parking"", ""Dishes and silverware"", ""Hangers"", ""Hair dryer"", ""Coffee maker: Nespresso, pour-over coffee"", ""Essentials"", ""Central air conditioning"", ""Paid street parking off premises"", ""Free washer \u2013 In unit"", ""Garden view"", ""Wine glasses"", ""Shower gel"", ""Microwave"", ""Outdoor dining area"", ""Extra pillows and blankets"", ""Luggage dropoff allowed"", ""Dishwasher"", ""Bed linens"", ""Cleaning products"", ""Hot water"", ""Oven"", ""Pets allowed"", ""Host greets you"", ""Private backyard \u2013 Fully fenced"", ""Coffee"", ""Clothing storage: walk-in closet and dresser"", ""Dining table"", ""Bidet"", ""Outdoor furniture"", ""Shampoo"", ""43 inch HDTV with standard cable"", ""Toaster""]",$90.00,2,7,2,6,7,7,2.1,7.0,,t,6,12,15,255,2024-06-22,486,67,8,2012-10-15,2024-06-20,4.78,4.86,4.69,4.86,4.82,4.72,4.68,,f,2,2,0,0,3.42
713411,https://www.airbnb.com/rooms/713411,20240622024403,2024-06-22,city scrape,Sunny Design Loft in Milan,"Discover a stylish retreat to rest and recharge. The tranquil home features soothing neutral grays throughout, pops of yellow, flowing indoor-to-outdoor spaces, an open-plan layout living room, and a patio dining area (the gazebo has been replaced by an open pergola).<br />Extremely bright and drenched in sunlight, the unit has a king size bed and a sleeping sofa that converts into a queen bed. <br />The heating system is set at 21 degrees for 14 hours/day as permitted by the law. No dinner parties allowed. No exceptions. <br />The standard price is for two people sharing the king size bed. Fees apply for the use of the sofa.<br /><br />Located in the Navigli area, one bedroom design loft with private garden and 24h concierge.<br />Extremely bright and drenched in sunlight, the unit has a king size bed and a sleeping sofa that converts into a queen.<br /><br />Bathroom with rain shower, towel warmer and bidet seat.<br /><br />Gourmet kitchen with dishwasher, microwave, oven, washer and","Explore the Navigli area to discover its treasures like cafes and restaurants. Jump on the tram into central Milan just 20 minutes away, home to historical sights, bars, renowned fashion boutiques, and shopping options.",https://a0.muscache.com/pictures/1a8802c5-e001-4c47-b35f-0e98eda6ad38.jpg,1527671,https://www.airbnb.com/users/show/1527671,Micol,2011-12-22,"Milan, Italy","I'm from Italy, I'm a 44 years old with a passion for design and fine dining.",within an hour,100%,98%,,https://a0.muscache.com/im/pictures/user/56b66012-a8c6-42bd-9acd-201ac1c9320a.jpg?aki_policy=profile_small,https://a0.muscache.com/im/pictures/user/56b66012-a8c6-42bd-9acd-201ac1c9320a.jpg?aki_policy=profile_x_medium,Zona 6,22,29,"['email', 'phone']",t,t,"Milan, Lombardy, Italy",GIAMBELLINO,,45.44927,9.14783,Entire loft,Entire home/apt,4,1.0,1 bath,1,2,"[""Kitchen"", ""Body soap"", ""Carbon monoxide alarm"", ""Wifi"", ""Self check-in"", ""First aid kit"", ""Stainless steel gas stove"", ""Fire extinguisher"", ""AC - split type ductless system"", ""Iron"", ""Coffee maker"", ""Exterior security cameras on property"", ""Refrigerator"", ""Room-darkening shades"", ""Hot water kettle"", ""Dishes and silverware"", ""Hangers"", ""Clothing storage: closet"", ""Hair dryer"", ""Elevator"", ""Essentials"", ""Building staff"", ""Free washer \u2013 In unit"", ""Wine glasses"", ""Freezer"", ""Drying rack for clothing"", ""58 inch HDTV with standard cable"", ""Outdoor dining area"", ""Luggage dropoff allowed"", ""Dishwasher"", ""Bed linens"", ""Cleaning products"", ""Hot water"", ""Oven"", ""Sun loungers"", ""Private backyard \u2013 Fully fenced"", ""Central heating"", ""Bidet"", ""Outdoor furniture"", ""Single level home"", ""Smoke alarm""]",$92.00,1,30,1,1,30,30,1.0,30.0,,t,18,48,78,168,2024-06-22,243,25,1,2014-04-14,2024-06-02,4.79,4.86,4.79,4.95,4.97,4.52,4.7,CIR 015146-CNI-02255,f,8,8,0,0,1.96
976817,https://www.airbnb.com/rooms/976817,20240622024403,2024-06-23,city scrape,LUXURY APARTMENT CENTRAL MILAN,"A beautifully refurbished 30 sq m pad divided into a sleeping and bathroom area and a dining, sofa and kitchenette. Ideal for one person. Also fine for a couple for a short stay.",A lively area of Milan just next to the beautiful Church of San Lorenzo and Roman Columns of San Lorenzo filled with bars and restaurants very close to the centre of town. Since the University of Milan is nearby the Piazza di San Lorenzo is a friendly atmospheric gathering point for young people on summer evenings buzzing with life.,https://a0.muscache.com/pictures/14614305/7cd67ef6_original.jpg,5344721,https://www.airbnb.com/users/show/5344721,Julia,2013-03-06,"Milan, Italy",I am British and have lived in Milan since 1992. I am married with three children.,N/A,N/A,100%,f,https://a0.muscache.com/im/pictures/user/b0476157-543c-406b-a9f4-330799db7920.jpg?aki_policy=profile_small,https://a0.muscache.com/im/pictures/user/b0476157-543c-406b-a9f4-330799db7920.jpg?aki_policy=profile_x_medium,Centro Storico,2,6,"['email', 'phone', 'work_email']",t,t,"Milan, Lombardy, Italy",TICINESE,,45.45661,9.182,Private room in rental unit,Private room,2,1.0,1 private bath,1,1,"[""Kitchen"", ""Wifi"", ""Iron"", ""Cooking basics"", ""Window AC unit"", ""Clothing storage: wardrobe"", ""Refrigerator"", ""Heating"", ""Dishes and silverware"", ""Hangers"", ""City skyline view"", ""Hair dryer"", ""Elevator"", ""Essentials"", ""Stove"", ""Free washer \u2013 In unit"", ""Dedicated workspace"", ""Drying rack for clothing"", ""Extra pillows and blankets"", ""Patio or balcony"", ""Bed linens"", ""Cleaning products"", ""Hot water"", ""TV"", ""Bidet"", ""Shampoo"", ""Host greets you""]",$120.00,5,365,5,5,1125,1125,5.0,1125.0,,t,1,22,52,327,2024-06-23,8,0,0,2014-03-03,2023-05-31,4.5,4.29,4.29,4.43,4.43,5.0,4.57,,t,1,0,1,0,0.06
982767,https://www.airbnb.com/rooms/982767,20240622024403,2024-06-22,city scrape,chic-mini loft,,,https://a0.muscache.com/pictures/44046208/e447b1a3_original.jpg,1812431,https://www.airbnb.com/users/show/1812431,Barbara,2012-02-26,"Milan, Italy","Barbara,
ragazza e mamma di 2 bellissimi pupi.
La vita e' un grande viaggio, il mondo ospita una dolce casa in ogni angolo.",within an hour,100%,45%,f,https://a0.muscache.com/im/users/1812431/profile_pic/1362829445/original.jpg?aki_policy=profile_small,https://a0.muscache.com/im/users/1812431/profile_pic/1362829445/original.jpg?aki_policy=profile_x_medium,Zona 5,4,8,"['email', 'phone']",t,t,,TICINESE,,45.4435,9.17724,Entire loft,Entire home/apt,2,1.0,1 bath,1,1,"[""Dedicated workspace"", ""Washer"", ""Heating"", ""TV"", ""Hangers"", ""Wifi"", ""Kitchen"", ""Hair dryer"", ""Essentials"", ""Courtyard view"", ""Long term stays allowed"", ""Iron"", ""Hot water"", ""Host greets you""]",$58.00,1,180,1,1,180,180,1.0,180.0,,t,8,36,54,235,2024-06-22,14,3,0,2013-11-23,2024-04-11,4.07,4.36,4.14,4.79,4.64,4.5,4.0,,f,4,2,2,0,0.11
