409509,https://www.airbnb.com/rooms/409509,20240622024403,2024-06-23,previous scrape,Fancy big 2 beds flat Centrale Porta Venezia Duomo,"Within a typical milanese atmosphere, it's an elegant 2 roomy beds flat located in Porta Venezia, between  Centrale Station & Duomo. Living-dining room, kitchenette, bathroom comfy and fully equipped. An accomodation like a home away from home, decorated from the owner who occasionally lives here. Only experienced guests with reviews. Read additional rules. You can book if you're the guest. Must provide your check-in time before booking. Check-in 3-10 pm, no late check-in. Check-out 10:00 am.","Walking distance for a stroll around,  to reach metro and tram station to move easily and quickly in town, to and from the train stations Centrale and Garibaldi. Out of 40 cool places on the planet, Porta Venezia is the only Italian district that has obtained a mention in the annual ranking of the English Time Out magazine. Famous for its Liberty style facade and Art Nouveau buildings, multi-ethnic restaurants, LGBT spaces, the Elfo Puccini Theatre, the Arcobaleno Cinema and its trendy clubs. Fully served with groceries, supermarkets or coffee-bars and resto. Shopping is round the corner with main international brands on Corso Buenos Aires. Recently, Porta Venezia has been reknown also as a Design District. Neighbourghood is live and safe. Some noise could be heard from the street because it's a lively district during evening but all windows are soundproof and air cool ventilation is provided during summer.",https://a0.muscache.com/pictures/airflow/Hosting-409509/original/9e6f6028-2f83-4a22-a66a-d908520a33ac.jpg,1865237,https://www.airbnb.com/users/show/1865237,Mira,2012-03-05,"Milan, Italy","Hallo everybody! My name is Mira. I am a travelaholic and I love to get to know people from different countries... that's how I got to Airbnb. I can be periodically out town. So, happy to be your host...or guest!",within a few hours,100%,83%,t,https://a0.muscache.com/im/pictures/user/1fb5b770-a69c-4898-af22-b23f4b960a00.jpg?aki_policy=profile_small,https://a0.muscache.com/im/pictures/user/1fb5b770-a69c-4898-af22-b23f4b960a00.jpg?aki_policy=profile_x_medium,Zona 3,3,3,"['email', 'phone']",t,t,"Milan, Lombardy, Italy",BUENOS AIRES - VENEZIA,,45.47728,9.20178,Entire condo,Entire home/apt,4,,1 bath,2,,"[""Conditioner"", ""Kitchen"", ""Body soap"", ""First aid kit"", ""Paid parking garage off premises"", ""Stainless steel gas stove"", ""Iron"", ""Fire extinguisher"", ""Cooking basics"", ""Bathtub"", ""Portable air conditioning"", ""Refrigerator"", ""Room-darkening shades"", ""Hot water kettle"", ""Heating"", ""Dishes and silverware"", ""Paid parking lot on premises"", ""Hangers"", ""City skyline view"", ""Clothing storage: closet and dresser"", ""Hair dryer"", ""Essentials"", ""Laundromat nearby"", ""Free washer \u2013 In unit"", ""Dedicated workspace"", ""Wine glasses"", ""Freezer"", ""Drying rack for clothing"", ""Shower gel"", ""Luggage dropoff allowed"", ""Fast wifi \u2013 550 Mbps"", ""Bed linens"", ""Cleaning products"", ""Hot water"", ""Coffee maker: french press"", ""Oven"", ""Portable fans"", ""Books and reading material"", ""Coffee"", ""Dining table"", ""Bidet"", ""Shampoo"", ""Host greets you""]",,7,28,5,7,28,28,6.7,28.0,,t,0,0,0,0,2024-06-23,7,2,0,2015-04-17,2024-04-21,4.86,5.0,5.0,5.0,5.0,5.0,4.86,015146-CNI-01168,f,3,2,1,0,0.06
206450,https://www.airbnb.com/rooms/206450,20240622024403,2024-06-23,city scrape,"Porta Romana, it's so Milan",,,https://a0.muscache.com/pictures/c424c60e-36c3-4daa-9ff3-74450ec1a511.jpg,930535,https://www.airbnb.com/users/show/930535,Francesco,2011-08-06,"Milan, Italy",:) I enjoy staying active! I want you to experience Milan to its fullest potential and have the best time possible while doing it!,N/A,N/A,100%,f,https://a0.muscache.com/im/users/930535/profile_pic/1382645072/original.jpg?aki_policy=profile_small,https://a0.muscache.com/im/users/930535/profile_pic/1382645072/original.jpg?aki_policy=profile_x_medium,Porta Romana,1,1,"['email', 'phone']",t,t,,PORTA ROMANA,,45.45238,9.20745,Entire condo,Entire home/apt,2,1.0,1 bath,1,1,"[""Washer"", ""Refrigerator"", ""Heating"", ""Dryer"", ""Dishes and silverware"", ""Kitchen"", ""Hangers"", ""Wifi"", ""Private patio or balcony"", ""Air conditioning"", ""Paid parking off premises"", ""Hair dryer"", ""Elevator"", ""Essentials"", ""TV with standard cable"", ""Shampoo"", ""Iron"", ""Hot water"", ""Host greets you"", ""Coffee maker""]",$140.00,2,20,2,2,1125,1125,2.0,1125.0,,t,0,3,3,25,2024-06-23,105,1,0,2011-09-18,2023-10-02,4.97,4.97,4.91,4.97,4.99,4.8,4.86,,t,1,1,0,0,0.68
409985,https://www.airbnb.com/rooms/409985,20240622024403,2024-06-22,city scrape,GLAM CENTRAL PENTHOUSE,"6th floor penthouse with beautiful terraces in the Isola district. The flat is really nice, cozy, very well equipped. The neighborhood is great, full of cafes, restaurants, shops and music venues (ie The Blue Note). 3 metro lines and lots of buses. Walking distance to Corso Como through the beautiful Bosco Verticale and Piazza Gae Aulenti. I enjoy taking extra care of my guests personally.","L'ISOLA is the place to be. Friendly and warm, welcomes everybody with restaurants of all sorts,  cafes, shops of any kind. You'll also find nice parks both for little kids and for your pets. <br />Three lines of the metro, lots of buses and trams, make it very easy to go around.<br />The apartment is, however, very kind. Perfect if you are working from home or just want to relax.",https://a0.muscache.com/pictures/4641144/cddbac15_original.jpg,2041012,https://www.airbnb.com/users/show/2041012,Sabrina,2012-03-31,"Milan, Italy","Hi there, it's Sabrina here. I'm a TV Creative Producer. I lived in US and UK, love travelling, reading, good food and wine, dogs, music ..... life in general!",within a few hours,100%,85%,f,https://a0.muscache.com/im/users/2041012/profile_pic/1333192010/original.jpg?aki_policy=profile_small,https://a0.muscache.com/im/users/2041012/profile_pic/1333192010/original.jpg?aki_policy=profile_x_medium,Centro Direzionale,1,1,"['email', 'phone']",t,t,"Milan, Lombardy, Italy",ISOLA,,45.49162,9.18314,Entire rental unit,Entire home/apt,4,1.0,1 bath,2,2,"[""Conditioner"", ""Window guards"", ""Body soap"", ""Kitchen"", ""Private patio or balcony"", ""Long term stays allowed"", ""First aid kit"", ""Pack \u2019n play/Travel crib"", ""42 inch HDTV with Amazon Prime Video, Disney+, Netflix, Roku, standard cable"", ""Iron"", ""Cooking basics"", ""Bathtub"", ""Ceiling fan"", ""Refrigerator"", ""Room-darkening shades"", ""Hot water kettle"", ""Baking sheet"", ""Dishes and silverware"", ""Paid parking lot on premises"", ""Hangers"", ""City skyline view"", ""Clothing storage: closet and dresser"", ""Hair dryer"", ""Ethernet connection"", ""Blender"", ""Essentials"", ""Crib"", ""Central air conditioning"", ""Elevator"", ""Laundromat nearby"", ""Free washer \u2013 In unit"", ""Children\u2019s dinnerware"", ""Dedicated workspace"", ""Smeg gas stove"", ""Wine glasses"", ""Freezer"", ""Drying rack for clothing"", ""Shower gel"", ""Outdoor dining area"", ""Extra pillows and blankets"", ""Luggage dropoff allowed"", ""Dishwasher"", ""Bed linens"", ""Cleaning products"", ""Hot water"", ""Oven"", ""Pets allowed"", ""Portable fans"", ""Books and reading material"", ""Coffee"", ""Central heating"", ""Fast wifi \u2013 95 Mbps"", ""Dining table"", ""Bidet"", ""Coffee maker: pour-over coffee"", ""Outdoor furniture"", ""Single level home"", ""Backyard"", ""Shampoo"", ""Host greets you"", ""Toaster""]",$150.00,3,30,3,3,30,30,3.0,30.0,,t,0,10,20,255,2024-06-22,106,12,0,2012-07-10,2024-04-11,4.92,4.89,4.88,5.0,5.0,4.77,4.78,,f,1,1,0,0,0.73
410480,https://www.airbnb.com/rooms/410480,20240622024403,2024-06-22,city scrape,Monolocale in condivisione zona Città Studi,"Studio to share with the owner and the companion, recently renovated complete with all the comforts,very convenient public transport to the center and airports. <br />You have to share with us, so please feel free to ask more info, thanks.<br />The open red couch ( see image) becomes a comfortable queen size bed available to the guest. All spaces are shared with the owner","During the April Furniture Show you will find numerous' Fuori Salone 'events just around the corner. University area with many supermarkets, restaurants at low prices, Saturday morning large municipal market where you can buy fruits and vegetables at low prices.<br />Very well served by public transport to the city center ( only 15 minutes), easy to reach airports and railway stations.<br />University area with many supermarkets, restaurants cheap, Saturday mornings big municipal market where you can buy fruits and vegetables at low prices Verame.<br />Well-served by public transport to the city center (only 15 minutes), easy to get to airports and train stations.",https://a0.muscache.com/pictures/54784800/8721cbfd_original.jpg,2043421,https://www.airbnb.com/users/show/2043421,Rhos,2012-03-31,"Milan, Italy","I am friendly and openminded man, i like to meet people from all parts of world, i dont have any kind of prejudice about religion culture or other.
My passion ? travel around the world , meet and learm more from people,also  i like to host people ( do you know couchsurfing?),often i am not in a city so i prefer to rent my studio.
",within a day,100%,0%,f,https://a0.muscache.com/im/users/2043421/profile_pic/1333297550/original.jpg?aki_policy=profile_small,https://a0.muscache.com/im/users/2043421/profile_pic/1333297550/original.jpg?aki_policy=profile_x_medium,,1,2,"['email', 'phone']",t,t,"Milan, Lombardy, Italy",CITTA' STUDI,,45.48072,9.237,Shared room in rental unit,Shared room,1,1.0,1 shared bath,1,1,"[""Washer"", ""Refrigerator"", ""Heating"", ""Free street parking"", ""Dishes and silverware"", ""TV"", ""Carbon monoxide alarm"", ""Wifi"", ""Kitchen"", ""Hair dryer"", ""Elevator"", ""Essentials"", ""Smoke alarm"", ""Shampoo"", ""Fire extinguisher"", ""Hot water"", ""Host greets you""]",$25.00,1,30,1,1,30,30,1.0,30.0,,t,0,0,15,15,2024-06-22,4,0,0,2015-10-05,2019-04-14,4.75,5.0,5.0,5.0,5.0,4.75,4.5,,f,1,0,0,1,0.04
218379,https://www.airbnb.com/rooms/218379,20240622024403,2024-06-22,city scrape,AMAZING LOFT NAVIGLI - PRIVATE ROOM,,,https://a0.muscache.com/pictures/1998695/07dd4ede_original.jpg,962865,https://www.airbnb.com/users/show/962865,Melissa,2011-08-12,"Milan, Italy","As hosts, me, my husband and our dog will welcome you in our home if you book the private room.

As guests, we love to rent apartments or rooms thru airbnb. We do this since many years and it's the perfect way to experience a place at the most. We'll take care of your place as we do with ours, if not more!",within a day,100%,0%,f,https://a0.muscache.com/im/users/962865/profile_pic/1315495854/original.jpg?aki_policy=profile_small,https://a0.muscache.com/im/users/962865/profile_pic/1315495854/original.jpg?aki_policy=profile_x_medium,Navigli,2,4,"['email', 'phone']",t,t,,NAVIGLI,,45.45017,9.17305,Private room in loft,Private room,1,1.0,1 shared bath,1,1,"[""Coffee maker: drip coffee maker, espresso machine, pour-over coffee"", ""Kitchen"", ""Wifi"", ""Paid parking off premises"", ""Long term stays allowed"", ""Courtyard view"", ""Iron"", ""Cooking basics"", ""Smoking allowed"", ""Refrigerator"", ""Hot water kettle"", ""Baking sheet"", ""Dishes and silverware"", ""Hangers"", ""Hair dryer"", ""Blender"", ""Essentials"", ""Stove"", ""Free washer \u2013 In unit"", ""Dedicated workspace"", ""Wine glasses"", ""Freezer"", ""Drying rack for clothing"", ""Microwave"", ""Extra pillows and blankets"", ""Patio or balcony"", ""Dishwasher"", ""Bed linens"", ""Hot water"", ""Mosquito net"", ""Oven"", ""Private backyard \u2013 Fully fenced"", ""Portable fans"", ""Coffee"", ""Central heating"", ""Clothing storage: dresser"", ""Bidet"", ""Outdoor furniture"", ""Host greets you"", ""Toaster""]",$90.00,2,1125,2,2,1125,1125,2.0,1125.0,,t,21,23,29,196,2024-06-22,10,1,0,2014-07-27,2023-07-08,4.8,4.9,4.7,4.89,5.0,4.89,4.78,,f,1,0,1,0,0.08
411118,https://www.airbnb.com/rooms/411118,20240622024403,2024-06-22,city scrape,TOP POSITION  Bed and Breakfast,"My beautiful apartment, mq 100, fully renovated with beautiful designer furniture is all white and it lends an air of relaxation and peace<br />It can comfortably accommodate two people having two bathrooms and a large double bedroom with wardrobe cabinet","The neighborhood is very safe and quiet and 20 mtr from my house there is a covered and secure parking for your car, only to payment<br />If you want to walk, you can go 1.5 km on foot and to arrive at historic center of Milan, San Babila, along the famous street Corso Buenos Aires, one of the most popular shopping streets in Milan.",https://a0.muscache.com/pictures/5393607/77f4f61f_original.jpg,2046698,https://www.airbnb.com/users/show/2046698,Daniela,2012-04-01,"Milan, Italy","Ciao sono Daniela vivo a Milano, sono una persona creativa e sono una designer di moda e tessuti. Il mio motto nella vita è ""volere è potere"", ce l'ho anche tatuato sul mio polso. Amo viaggiare ...ma amo ancora di più tornare a casa e trovare che qualcuno abbia cucinato e preparato tutto per me.....!!!!

Hello, I am Daniela I live in Milan, are a creative person and I am a designer of fashion and textiles. The motto of my life is ""If you want, you can do it "", I've also tattooed  it  on my right wrist. I love to travel ... but I still love to came back home and to find someone  that he has cooked and prepared something for me .....!!",within an hour,100%,100%,f,https://a0.muscache.com/im/users/2046698/profile_pic/1333281435/original.jpg?aki_policy=profile_small,https://a0.muscache.com/im/users/2046698/profile_pic/1333281435/original.jpg?aki_policy=profile_x_medium,Città Studi,1,1,"['email', 'phone']",t,t,"Milan, Lombardy, Italy",BUENOS AIRES - VENEZIA,,45.47895,9.21853,Private room in rental unit,Private room,2,2.0,2 baths,1,1,"[""Washer"", ""Kitchen"", ""Carbon monoxide alarm"", ""Wifi"", ""Lock on bedroom door"", ""Long term stays allowed"", ""First aid kit"", ""Iron"", ""Fire extinguisher"", ""Cooking basics"", ""Coffee maker"", ""Refrigerator"", ""Heating"", ""Free street parking"", ""Dishes and silverware"", ""Hangers"", ""Hair dryer"", ""Elevator"", ""Paid parking on premises"", ""Essentials"", ""Stove"", ""Shared hot tub"", ""Dedicated workspace"", ""Shower gel"", ""Microwave"", ""Extra pillows and blankets"", ""Dishwasher"", ""Bed linens"", ""Hot water"", ""Oven"", ""TV"", ""Shampoo"", ""Smoke alarm"", ""Host greets you"", ""Breakfast""]",$83.00,2,1125,2,2,1125,1125,2.0,1125.0,,t,26,56,68,272,2024-06-22,78,1,0,2012-04-19,2024-05-20,4.85,4.86,4.85,4.88,4.87,4.77,4.77,,f,1,0,1,0,0.53
412833,https://www.airbnb.com/rooms/412833,20240622024403,2024-06-22,city scrape,Modern Apartment Next to the Duomo,"Lisence nr. CIR 015146-CNI-01818<br /><br />Modern and stylish 2 bedroom and 2 bathroom apartment in the very center of Milan will be your home during your stay in Milan.<br />Fully furnished, modern furniture, comfortable beds everything you need for your short or longer stay. <br /><br />Either you want to cook we have organized fully furnished kitchen for you or if you prefer to dine outside - many restaurants and coffe shops just minutes away.","Local coffee shops, bakeries, grocers, and the Missori metro station are just steps from the flat. The area is filled with restaurants, boutiques, and historic sights, and the Montenapoleone luxury shopping district is also only a short walk away.",https://a0.muscache.com/pictures/b33b85a1-694f-40c2-907d-385210665234.jpg,2054298,https://www.airbnb.com/users/show/2054298,Ilona,2012-04-02,"Dubai, United Arab Emirates","Hi! I’m Ilona - homeowner since 2011. 
I’m originally from Riga (Latvia), but life brought me to live abroad. 

My goal is to offer unforgettable experience to my guests and to watch them leaving happy. 



",within an hour,100%,100%,t,https://a0.muscache.com/im/pictures/user/b7c0d011-a4ff-4247-aa00-f6859ed58d13.jpg?aki_policy=profile_small,https://a0.muscache.com/im/pictures/user/b7c0d011-a4ff-4247-aa00-f6859ed58d13.jpg?aki_policy=profile_x_medium,,4,4,"['email', 'phone']",t,t,"Milan, Lombardy, Italy",DUOMO,,45.46173095703125,9.192668914794922,Entire condo,Entire home/apt,5,2.0,2 baths,2,4,"[""Smart lock"", ""Washer"", ""Children\u2019s books and toys"", ""Kitchen"", ""Body soap"", ""Carbon monoxide alarm"", ""Wifi"", ""High chair"", ""Self check-in"", ""Babysitter recommendations"", ""First aid kit"", ""Pack \u2019n play/Travel crib"", ""Iron"", ""Fire extinguisher"", ""Cooking basics"", ""Coffee maker"", ""Refrigerator"", ""Room-darkening shades"", ""Heating"", ""Dishes and silverware"", ""Hangers"", ""Hair dryer"", ""Elevator"", ""Paid parking on premises"", ""Essentials"", ""Crib"", ""Central air conditioning"", ""Stove"", ""Free dryer \u2013 In unit"", ""Dedicated workspace"", ""Microwave"", ""Extra pillows and blankets"", ""Luggage dropoff allowed"", ""Dishwasher"", ""Bed linens"", ""Hot water"", ""Oven"", ""Pets allowed"", ""TV"", ""Single level home"", ""Shampoo"", ""Smoke alarm""]",$410.00,2,28,2,2,1125,1125,2.0,1125.0,,t,5,9,27,142,2024-06-22,255,40,3,2012-07-17,2024-06-13,4.89,4.93,4.88,4.87,4.86,4.95,4.71,,f,2,2,0,0,1.75
224432,https://www.airbnb.com/rooms/224432,20240622024403,2024-06-22,city scrape,"Really bright flat, downtown Milan","This flat is situated on the second floor, and it's composed of a really bright and open dining room linked with the kitchen, a small corridor, a bathroom and a nice bedroom with a queen size bed.","It's calm and pretty, very close to downtown, you don't need the car to move but there are many buses and trams which can bring you everywhere. Nice cafes and good restaurants around!",https://a0.muscache.com/pictures/31166554/b9cf0f3b_original.jpg,144021,https://www.airbnb.com/users/show/144021,Silvia&Max,2010-06-14,"Milan, Italy","We're two dear friends and we live in the same building. Me, Silvia, I am an actress and when I'm not home I rent my beautiful new flat, in which I live. I have been renting it with Airbnb since 2010, and have had only good experiences. At first, it wasn't so easy to let my flat to people I didn't know, to trust them; but I have met only nice people, respectful (so far!) and I hope to continue to! 
I also rent just the second room.

Max doesn't live in the flat he rents, so it might be more available than mine. Ask us and we'll answer you as soon as possible.

",within a few hours,100%,83%,t,https://a0.muscache.com/im/users/144021/profile_pic/1425251838/original.jpg?aki_policy=profile_small,https://a0.muscache.com/im/users/144021/profile_pic/1425251838/original.jpg?aki_policy=profile_x_medium,Porta Vittoria,3,7,"['email', 'phone']",t,t,"Milan, Lombardy, Italy",XXII MARZO,,45.46433,9.20965,Entire rental unit,Entire home/apt,4,1.0,1 bath,1,2,"[""Kitchen"", ""Body soap"", ""Wifi"", ""Private patio or balcony"", ""First aid kit"", ""Iron"", ""Cooking basics"", ""Mini fridge"", ""Bathtub"", ""Coffee maker"", ""Refrigerator"", ""Hot water kettle"", ""Heating"", ""Baking sheet"", ""Dishes and silverware"", ""Hangers"", ""Hair dryer"", ""Elevator"", ""Gas stove"", ""Essentials"", ""Paid parking on premises"", ""Central air conditioning"", ""Free washer \u2013 In unit"", ""Garden view"", ""Dedicated workspace"", ""Freezer"", ""Drying rack for clothing"", ""Shower gel"", ""Microwave"", ""Extra pillows and blankets"", ""Dishwasher"", ""TV with standard cable"", ""Bed linens"", ""Cleaning products"", ""Hot water"", ""Mosquito net"", ""Oven"", ""Portable fans"", ""Books and reading material"", ""Coffee"", ""Dining table"", ""Bidet"", ""Single level home"", ""Shampoo"", ""Host greets you"", ""Toaster""]",$109.00,3,31,3,3,31,31,3.0,31.0,,t,0,26,51,161,2024-06-22,210,19,3,2011-09-25,2024-06-17,4.89,4.9,4.86,4.92,4.95,4.82,4.84,,f,3,3,0,0,1.35
414257,https://www.airbnb.com/rooms/414257,20240622024403,2024-06-23,city scrape,Le Parisienne - Lovely studio in Porta Romana,"Welcome to Milan downtown!<br /><br />Lovely studio very close to the underground M3 Porta Romana.<br /><br />Air conditioning, heating, TV LCD, fully equipped kitchenette.<br />Bed Linen and bath towels available.<br /><br />We offer a longer transitional contract, with a lower rate than the daily rate at no additional cost, also offering optional linen change and cleaning.","I don't have wi-fi but I can suggest the Coffice Milano: not just a coffe, it's a coworking space, a urban bar with wi-fi. Instead to stay alone at home you can work in a relaxing environment.  Your business travel we'll be social and funny!",https://a0.muscache.com/pictures/103316028/d2d0cac7_original.jpg,1750205,https://www.airbnb.com/users/show/1750205,Claudia,2012-02-14,"Milan, Italy","mi piace viaggiare nelle città d'arte europee, adoro visitare musei, chiese e luoghi d'interesse architettonico.",within a day,90%,40%,f,https://a0.muscache.com/im/pictures/user/54b73605-7337-4d49-a67f-0e1953840b99.jpg?aki_policy=profile_small,https://a0.muscache.com/im/pictures/user/54b73605-7337-4d49-a67f-0e1953840b99.jpg?aki_policy=profile_x_medium,,9,17,"['email', 'phone']",t,t,"Milan, Lombardy, Italy",VIGENTINA,,45.45455,9.19759,Entire condo,Entire home/apt,2,1.0,1 bath,1,1,"[""Washer"", ""Kitchen"", ""Wifi"", ""Long term stays allowed"", ""Refrigerator"", ""Electric stove"", ""Hot water kettle"", ""Heating"", ""Baking sheet"", ""Dishes and silverware"", ""Coffee maker: Nespresso"", ""Hair dryer"", ""Elevator"", ""Essentials"", ""Freezer"", ""Microwave"", ""Outdoor shower"", ""Bed linens"", ""Cleaning products"", ""Hot water"", ""TV"", ""Air conditioning"", ""Dining table"", ""Bidet"", ""Toaster""]",$70.00,28,120,28,28,120,120,28.0,120.0,,t,24,54,84,264,2024-06-23,8,0,0,2012-10-06,2022-06-08,3.17,3.43,3.43,3.0,3.14,3.71,3.14,,f,7,2,5,0,0.06
414465,https://www.airbnb.com/rooms/414465,20240622024403,2024-06-22,city scrape,Montestella - Casa Indipendente,"The service includes bed linen and towels is all you need for cooking, parking, and the public is not private<br />Ground floor: living room with fireplace, kitchen, bathroom and garden.<br />1st floor, 2 double bedrooms, bathroom with bathtub<br />attic 1 double bed and sofa bed and lounge","my paper mills and comfortable has a large shopping center always open on Sunday the QT8 Metro is 10 minutes walk, 15 minutes by tram you can reach the arch of peace where you can find all the clubs and trendy bars",https://a0.muscache.com/pictures/27215532/18dfbd43_original.jpg,2061296,https://www.airbnb.com/users/show/2061296,Sergio,2012-04-03,"Milan, Italy","Ciao, sono Sergio, amo lo sport,, adoro gli animali,",within a few hours,90%,98%,t,https://a0.muscache.com/im/pictures/user/User-2061296/original/563cc841-4137-41d4-8e70-f07b214caa88.jpeg?aki_policy=profile_small,https://a0.muscache.com/im/pictures/user/User-2061296/original/563cc841-4137-41d4-8e70-f07b214caa88.jpeg?aki_policy=profile_x_medium,Zona 8,1,2,"['email', 'phone']",t,t,"Milan, Lombardy, Italy",VILLAPIZZONE,,45.49608,9.1381,Entire villa,Entire home/apt,10,2.0,2 baths,3,5,"[""Washer"", ""Private entrance"", ""Window guards"", ""Body soap"", ""Wifi"", ""Kitchen"", ""Private patio or balcony"", ""Courtyard view"", ""First aid kit"", ""Iron"", ""Cooking basics"", ""Indoor fireplace"", ""Bathtub"", ""Refrigerator"", ""Room-darkening shades"", ""Heating"", ""Free street parking"", ""Dishes and silverware"", ""Hangers"", ""City skyline view"", ""Hair dryer"", ""Ethernet connection"", ""Gas stove"", ""Essentials"", ""Blender"", ""Laundromat nearby"", ""Garden view"", ""Dedicated workspace"", ""Freezer"", ""Drying rack for clothing"", ""Shower gel"", ""Microwave"", ""Outdoor dining area"", ""Extra pillows and blankets"", ""Bed linens"", ""Cleaning products"", ""Hot water"", ""Fireplace guards"", ""Private backyard \u2013 Fully fenced"", ""Portable fans"", ""Clothing storage"", ""Coffee"", ""TV"", ""Park view"", ""Air conditioning"", ""Bidet"", ""Dining table"", ""Outdoor furniture"", ""Coffee maker: espresso machine"", ""Shampoo"", ""Toaster""]",$364.00,2,30,2,2,30,30,2.0,30.0,,t,16,42,64,324,2024-06-22,168,36,4,2012-09-11,2024-06-17,4.66,4.78,4.38,4.91,4.85,4.35,4.69,,f,1,1,0,0,1.17
